{
  "$schema": "https://json-schema.org/draft/2020-12/schema",
  "$id": "clevr_multiview_protocol.schema.json",
  "title": "ColorPeel CLEVR 3x3 multiview protocol",
  "type": "object",
  "additionalProperties": false,
  "required": [
    "version",
    "protocol_id",
    "base_manifest",
    "views_per_cell",
    "view_splits",
    "render_seed",
    "renderer_profile",
    "folds",
    "realization_contract"
  ],
  "properties": {
    "$schema": {"type": "string"},
    "version": {"const": 1},
    "protocol_id": {"const": "clevr_subject_color_3x3_multiview_v1"},
    "base_manifest": {"type": "string"},
    "views_per_cell": {"const": 20},
    "view_splits": {
      "type": "object",
      "additionalProperties": false,
      "required": ["train", "audit"],
      "properties": {
        "train": {"$ref": "#/$defs/range"},
        "audit": {"$ref": "#/$defs/range"}
      }
    },
    "render_seed": {
      "type": "object",
      "additionalProperties": false,
      "required": ["base", "cell_stride", "formula"],
      "properties": {
        "base": {"const": 420000},
        "cell_stride": {"const": 100},
        "formula": {"const": "base + cell_index * cell_stride + view_index"}
      }
    },
    "renderer_profile": {
      "type": "object",
      "additionalProperties": false,
      "required": ["id", "config", "background"],
      "properties": {
        "id": {"const": "multiview_render_v1"},
        "config": {"const": "../configs/multiview_render.json"},
        "background": {
          "type": "object",
          "additionalProperties": false,
          "required": ["profile_id", "varied", "world_rgba", "ground_rgba"],
          "properties": {
            "profile_id": {"const": "clevr_neutral_fixed_v1"},
            "varied": {"const": false},
            "world_rgba": {"const": [0.05, 0.05, 0.05, 1.0]},
            "ground_rgba": {"const": [0.5, 0.5, 0.5, 1.0]}
          }
        }
      }
    },
    "folds": {
      "type": "array",
      "minItems": 3,
      "maxItems": 3,
      "items": {
        "type": "object",
        "additionalProperties": false,
        "required": ["id", "held_out"],
        "properties": {
          "id": {"enum": ["A", "B", "C"]},
          "held_out": {
            "type": "array",
            "minItems": 3,
            "maxItems": 3,
            "items": {
              "type": "array",
              "prefixItems": [
                {"enum": ["cube", "sphere", "cylinder"]},
                {"enum": ["red", "cyan", "gray"]}
              ],
              "items": false
            }
          }
        }
      }
    },
    "realization_contract": {
      "type": "object",
      "additionalProperties": false,
      "required": [
        "resolution",
        "image_mode",
        "mask_mode",
        "mask_values",
        "renderer_owned_fields",
        "empirical_rgb"
      ],
      "properties": {
        "resolution": {"const": [512, 512]},
        "image_mode": {"const": "RGB"},
        "mask_mode": {"const": "L"},
        "mask_values": {"const": [0, 255]},
        "renderer_owned_fields": {
          "const": [
            "camera",
            "light",
            "background",
            "scene_json",
            "image",
            "mask",
            "background_mask"
          ]
        },
        "empirical_rgb": {
          "type": "object",
          "additionalProperties": false,
          "required": ["space", "statistic", "source"],
          "properties": {
            "space": {"const": "srgb_u8"},
            "statistic": {"const": "masked_mean"},
            "source": {"const": "realized_view_gt_mask"}
          }
        }
      }
    }
  },
  "$defs": {
    "range": {
      "type": "object",
      "additionalProperties": false,
      "required": ["start", "stop"],
      "properties": {
        "start": {"type": "integer", "minimum": 0},
        "stop": {"type": "integer", "minimum": 1, "maximum": 20}
      }
    }
  }
}
